{
  "$schema": "http://json-schema.org/draft-04/schema#",
  "type": "object",
  "properties": {
    "id": {
      "type": "string"
    },
    "type": {
      "type": "string"
    },
    "refI4AssetId": {
      "type": "string"
    },
    "refI4AASId": {
      "type": "string"
    },
    "semanticId": {
      "type": "object",
      "properties": {
        "keys": {
          "type": "array",
          "items": {}
        }
      },
      "required": [
        "keys"
      ]
    },
    "qualifiers": {
      "type": "array",
      "items": {}
    },
    "hasDataSpecification": {
      "type": "array",
      "items": {}
    },
    "identification": {
      "type": "object",
      "properties": {
        "idType": {
          "type": "string"
        },
        "id": {
          "type": "string"
        }
      },
      "required": [
        "idType",
        "id"
      ]
    },
    "administration": {
      "type": "object",
      "properties": {
        "version": {
          "type": "string"
        },
        "revision": {
          "type": "string"
        }
      },
      "required": [
        "version",
        "revision"
      ]
    },
    "idShort": {
      "type": "string"
    },
    "category": {
      "type": "string"
    },
    "modelType": {
      "type": "object",
      "properties": {
        "name": {
          "type": "string"
        }
      },
      "required": [
        "name"
      ]
    },
    "kind": {
      "type": "string"
    },
    "submodelElements": {
      "type": "array",
      "items": [
        {
          "type": "object",
          "properties": {
            "refSubmodelElement": {
              "type": "string"
            },
            "idShort": {
              "type": "string"
            },
            "category": {
              "type": "string"
            },
            "modelType": {
              "type": "object",
              "properties": {
                "name": {
                  "type": "string"
                }
              },
              "required": [
                "name"
              ]
            }
          },
          "required": [
            "refSubmodelElement",
            "idShort",
            "category",
            "modelType"
          ]
        },
        {
          "type": "object",
          "properties": {
            "refSubmodelElement": {
              "type": "string"
            },
            "idShort": {
              "type": "string"
            },
            "category": {
              "type": "string"
            },
            "modelType": {
              "type": "object",
              "properties": {
                "name": {
                  "type": "string"
                }
              },
              "required": [
                "name"
              ]
            }
          },
          "required": [
            "refSubmodelElement",
            "idShort",
            "category",
            "modelType"
          ]
        },
        {
          "type": "object",
          "properties": {
            "refSubmodelElement": {
              "type": "string"
            },
            "idShort": {
              "type": "string"
            },
            "category": {
              "type": "string"
            },
            "modelType": {
              "type": "object",
              "properties": {
                "name": {
                  "type": "string"
                }
              },
              "required": [
                "name"
              ]
            }
          },
          "required": [
            "refSubmodelElement",
            "idShort",
            "category",
            "modelType"
          ]
        }
      ]
    },
    "descriptions": {
      "type": "array",
      "items": [
        {
          "type": "object",
          "properties": {
            "language": {
              "type": "string"
            },
            "text": {
              "type": "string"
            }
          },
          "required": [
            "language",
            "text"
          ]
        }
      ]
    }
  },
  "required": [
    "id",
    "type",
    "refI4AssetId",
    "refI4AASId",
    "semanticId",
    "qualifiers",
    "hasDataSpecification",
    "identification",
    "administration",
    "idShort",
    "category",
    "modelType",
    "kind",
    "submodelElements",
    "descriptions"
  ]
}