{
        "id": "urn:ngsi-v2:RAMI40:I4Submodel:OperationalData:AASMRobotVI",
        "type": "I4Submodel",
        "administration": {
            "version": "1.0",
            "revision": ""
        },
        "category": "CONSTANT",
        "descriptions": [
            {
                "language": "en",
                "text": "It contains all the data related to operations of MRobot and VI system"
            }
        ],
        "hasDataSpecification": [],
        "idShort": "OperationalData",
        "identification": {
            "idType": "IRI",
            "id": "urn:ngsi-v2:RAMI40:I4Submodel:OperationalData:AASMRobotVI"
        },
        "kind": "Instance",
        "modelType": {
            "name": "Submodel"
        },
        "qualifiers": [],
        "refI4AASId": "urn:ngsi-v2:RAMI40:I4AAS:MRobotVI:AASMRobotVI",
        "refI4AssetId": "urn:ngsi-v2:RAMI40:I4Asset:MRobotVI:AASMRobotVI",
        "semanticId": {
            "keys": []
        },
        "submodelElements": [
            {
                "refI4SubmodelElement": "urn:ngsi-v2:RAMI40:I4SubmodelElementProperty:OperationalData:VIResults :AASMRobotVI",
                "idShort": "VIResults ",
                "category": "PARAMETER",
                "modelType": {
                    "name": "Property"
                }
            }
        ]
    }