{
    "id": "urn:ngsi-v2:RAMI40:I4Submodel:Nameplate:AASMRobotVI",
    "type": "I4Submodel",
    "administration": {
        "version": "1.0",
        "revision": ""
    },
    "category": "CONSTANT",
    "descriptions": [
        {
            "language": "en",
            "text": "Contains data relared to the physical ICrate"
        }
    ],
    "hasDataSpecification": [],
    "idShort": "Nameplate",
    "identification": {
        "idType": "IRI",
        "id": "urn:ngsi-v2:RAMI40:I4Submodel:Nameplate:AASMRobotVI"
    },
    "kind": "Instance",
    "modelType": {
        "name": "Submodel"
    },
    "qualifiers": [],
    "refI4AASId": "urn:ngsi-v2:RAMI40:I4AAS:MRobotVI:AASMRobotVI",
    "refI4AssetId": "urn:ngsi-v2:RAMI40:I4Asset:MRobotVI:AASMRobotVI",
    "semanticId": {
        "keys": []
    },
    "submodelElements": [
        {
            "refI4SubmodelElement": "urn:ngsi-v2:RAMI40:I4SubmodelElementProperty:Nameplate:ManufacturerName:AASMRobotVI",
            "idShort": "ManufacturerName",
            "category": "PARAMETER",
            "modelType": {
                "name": "Property"
            }
        },
        {
            "refI4SubmodelElement": "urn:ngsi-v2:RAMI40:I4SubmodelElementProperty:Nameplate:ManufacturerProductDesignation:AASMRobotVI",
            "idShort": "ManufacturerProductDesignation",
            "category": "PARAMETER",
            "modelType": {
                "name": "Property"
            }
        },
        {
            "refI4SubmodelElement": "urn:ngsi-v2:RAMI40:I4SubmodelElementProperty:Nameplate:ManufacturerProductFamily:AASMRobotVI",
            "idShort": "ManufacturerProductFamily",
            "category": "PARAMETER",
            "modelType": {
                "name": "Property"
            }
        },
        {
            "refI4SubmodelElement": "urn:ngsi-v2:RAMI40:I4SubmodelElementProperty:Nameplate:YearOfConstruction:AASMRobotVI",
            "idShort": "YearOfConstruction",
            "category": "PARAMETER",
            "modelType": {
                "name": "Property"
            }
        },
        {
            "refI4SubmodelElement": "urn:ngsi-v2:RAMI40:I4SubmodelElementProperty:Nameplate:SerialNumber:AASMRobotVI",
            "idShort": "SerialNumber",
            "category": "PARAMETER",
            "modelType": {
                "name": "Property"
            }
        },
        {
            "refI4SubmodelElement": "urn:ngsi-v2:RAMI40:I4SubmodelElementProperty:Nameplate:ClassificationSystem:AASMRobotVI",
            "idShort": "ClassificationSystem",
            "category": "PARAMETER",
            "modelType": {
                "name": "Property"
            }
        },
        {
            "refI4SubmodelElement": "urn:ngsi-v2:RAMI40:I4SubmodelElementProperty:Nameplate:DateOfManufacture:AASMRobotVI",
            "idShort": "DateOfManufacture",
            "category": "PARAMETER",
            "modelType": {
                "name": "Property"
            }
        },
        {
            "refI4SubmodelElement": "urn:ngsi-v2:RAMI40:I4SubmodelElementProperty:Nameplate:ProductCountryOfOrigin:AASMRobotVI",
            "idShort": "ProductCountryOfOrigin",
            "category": "PARAMETER",
            "modelType": {
                "name": "Property"
            }
        },
        {
            "refI4SubmodelElement": "urn:ngsi-v2:RAMI40:I4SubmodelElementProperty:Nameplate:QrCode:AASMRobotVI",
            "idShort": "QrCode",
            "category": "PARAMETER",
            "modelType": {
                "name": "Property"
            }
        },
        {
            "refI4SubmodelElement": "urn:ngsi-v2:RAMI40:I4SubmodelElementProperty:Nameplate:ProductIdentifier:AASMRobotVI",
            "idShort": "ProductIdentifier",
            "category": "PARAMETER",
            "modelType": {
                "name": "Property"
            }
        },
        {
            "refI4SubmodelElement": "urn:ngsi-v2:RAMI40:I4SubmodelElementProperty:Nameplate:CountryCode:AASMRobotVI",
            "idShort": "CountryCode",
            "category": "PARAMETER",
            "modelType": {
                "name": "Property"
            }
        },
        {
            "refI4SubmodelElement": "urn:ngsi-v2:RAMI40:I4SubmodelElementProperty:Nameplate:Street:AASMRobotVI",
            "idShort": "Street",
            "category": "PARAMETER",
            "modelType": {
                "name": "Property"
            }
        },
        {
            "refI4SubmodelElement": "urn:ngsi-v2:RAMI40:I4SubmodelElementProperty:Nameplate:Zip:AASMRobotVI",
            "idShort": "Zip",
            "category": "PARAMETER",
            "modelType": {
                "name": "Property"
            }
        },
        {
            "refI4SubmodelElement": "urn:ngsi-v2:RAMI40:I4SubmodelElementProperty:Nameplate:CityTown:AASMRobotVI",
            "idShort": "CityTown",
            "category": "PARAMETER",
            "modelType": {
                "name": "Property"
            }
        },
        {
            "refI4SubmodelElement": "urn:ngsi-v2:RAMI40:I4SubmodelElementProperty:Nameplate:StateCounty:AASMRobotVI",
            "idShort": "StateCounty",
            "category": "PARAMETER",
            "modelType": {
                "name": "Property"
            }
        }
    ]
}