{
  "id": "urn:ngsi-ld:RAMI40:I4Submodel:PositionalData:IC001",
  "type": "I4Submodel",
  "refI4AssetId": "urn:ngsi-ld:RAMI40:I4Asset:iCrate:IC001",
  "refI4AASId":"urn:ngsi-ld:RAMI40:I4AAS:iCrate:IC001",
  "semanticId": {
    "keys": []
  },
  "qualifiers": [],
  "hasDataSpecification": [],
  "identification": {
    "idType": "IRI",
    "id": "urn:ngsi-ld:RAMI40:I4Submodel:PositionalData:IC001"
  },
  "administration": {
    "version": "1.0",
    "revision": ""
  },
  "idShort": "PositionalData",
  "category": "CONSTANT",
  "modelType": {
    "name": "Submodel"
  },
  "kind": "Instance",
  "submodelElements": [
    {
      "refSubmodelElement": "urn:ngsi-ld:RAMI40:I4SubmodelElementProperty:PositionalData:PreviousPosition:IC001",
      "idShort": "PreviousPosition",
      "category": "PARAMETER",
      "modelType": {
        "name": "Property"
      }
    },
    {
      "refSubmodelElement": "urn:ngsi-ld:RAMI40:I4SubmodelElementProperty:PositionalData:CurrentPosition:IC001",
      "idShort": "CurrentPosition",
      "category": "PARAMETER",
      "modelType": {
        "name": "Property"
      }
    },
    {
      "refSubmodelElement": "urn:ngsi-ld:RAMI40:I4SubmodelElementProperty:PositionalData:NextPlannedPosition:IC001",
      "idShort": "NextPlannedPosition",
      "category": "PARAMETER",
      "modelType": {
        "name": "Property"
      }
    }
  ],
  "descriptions": [
    {
      "language": "en",
      "text": "Submodel positional data. Contains data about the position of the crate"
    }
  ]
}
