{
    "id": "urn:ngsi-v2:RAMI40:I4Submodel:AssetConditionMonitoring:AASMRobotVI",
    "type": "I4Submodel",
    "administration": {
        "version": "1.0",
        "revision": ""
    },
    "category": "CONSTANT",
    "descriptions": [
        {
            "language": "en",
            "text": "Submodel asset condition monitoring[contains properties related to the health of the crate]"
        }
    ],
    "hasDataSpecification": [],
    "idShort": "AssetConditionMonitoring",
    "identification": {
        "idType": "IRI",
        "id": "urn:ngsi-v2:RAMI40:I4Submodel:AssetConditionMonitoring:AASMRobotVI"
    },
    "kind": "Instance",
    "modelType": {
        "name": "Submodel"
    },
    "qualifiers": [],
    "refI4AASId": "urn:ngsi-v2:RAMI40:I4AAS:MRobotVI:AASMRobotVI",
    "refI4AssetId": "urn:ngsi-v2:RAMI40:I4Asset:MRobotVI:AASMRobotVI",
    "semanticId": {
        "keys": []
    },
    "submodelElements": [
        {
            "refI4SubmodelElement": "urn:ngsi-v2:RAMI40:I4SubmodelElementProperty:AssetConditionMonitoring:MRobotStatus:AASMRobotVI",
            "idShort": "MRobotStatus",
            "category": "PARAMETER",
            "modelType": {
                "name": "Property"
            }
        },
        {
            "refI4SubmodelElement": "urn:ngsi-v2:RAMI40:I4SubmodelElementProperty:AssetConditionMonitoring:MRobotMovementStatus:AASMRobotVI",
            "idShort": "MRobotMovementStatus",
            "category": "PARAMETER",
            "modelType": {
                "name": "Property"
            }
        },
        {
            "refI4SubmodelElement": "urn:ngsi-v2:RAMI40:I4SubmodelElementProperty:AssetConditionMonitoring:MRobotObjectHeld:AASMRobotVI",
            "idShort": "MRobotObjectHeld",
            "category": "PARAMETER",
            "modelType": {
                "name": "Property"
            }
        },
        {
            "refI4SubmodelElement": "urn:ngsi-v2:RAMI40:I4SubmodelElementProperty:AssetConditionMonitoring:MRobotTaskStatus:AASMRobotVI",
            "idShort": "MRobotTaskStatus",
            "category": "PARAMETER",
            "modelType": {
                "name": "Property"
            }
        },
        {
            "refI4SubmodelElement": "urn:ngsi-v2:RAMI40:I4SubmodelElementProperty:AssetConditionMonitoring:MRobotTaskID:AASMRobotVI",
            "idShort": "MRobotTaskID",
            "category": "PARAMETER",
            "modelType": {
                "name": "Property"
            }
        },
        {
            "refI4SubmodelElement": "urn:ngsi-v2:RAMI40:I4SubmodelElementProperty:AssetConditionMonitoring:VIStatus:AASMRobotVI",
            "idShort": "VIStatus",
            "category": "PARAMETER",
            "modelType": {
                "name": "Property"
            }
        },
        {
            "refI4SubmodelElement": "urn:ngsi-v2:RAMI40:I4SubmodelElementProperty:AssetConditionMonitoring:VITaskStatus:AASMRobotVI",
            "idShort": "VITaskStatus",
            "category": "PARAMETER",
            "modelType": {
                "name": "Property"
            }
        },
        {
            "refI4SubmodelElement": "urn:ngsi-v2:RAMI40:I4SubmodelElementProperty:AssetConditionMonitoring:VITaskID:AASMRobotVI",
            "idShort": "VITaskID",
            "category": "PARAMETER",
            "modelType": {
                "name": "Property"
            }
        },
        {
            "refI4SubmodelElement": "urn:ngsi-v2:RAMI40:I4SubmodelElementProperty:AssetConditionMonitoring:CobotDRobotWorkspaceFree:AASMRobotVI",
            "idShort": "CobotDRobotWorkspaceFree",
            "category": "PARAMETER",
            "modelType": {
                "name": "Property"
            }
        }
    ]
}