{
    "id": "urn:ngsi-v2:RAMI40:I4Submodel:OperationalCapability:AASMRobotVI",
    "type": "I4Submodel",
    "administration": {
        "version": "1.0",
        "revision": ""
    },
    "category": "CONSTANT",
    "descriptions": [
        {
            "language": "en",
            "text": "Submodel operational capability [contains various data related to the operation capability of sensor]"
        }
    ],
    "hasDataSpecification": [],
    "idShort": "OperationalCapability",
    "identification": {
        "idType": "IRI",
        "id": "urn:ngsi-v2:RAMI40:I4Submodel:OperationalCapability:AASMRobotVI"
    },
    "kind": "Instance",
    "modelType": {
        "name": "Submodel"
    },
    "qualifiers": [],
    "refI4AASId": "urn:ngsi-v2:RAMI40:I4AAS:MRobotVI:AASMRobotVI",
    "refI4AssetId": "urn:ngsi-v2:RAMI40:I4Asset:MRobotVI:AASMRobotVI",
    "semanticId": {
        "keys": []
    },
    "submodelElements": [
        {
            "refI4SubmodelElement": "urn:ngsi-v2:RAMI40:I4SubmodelElementOperation:OperationalCapability:MRobotReturnStackError:AASMRobotVI",
            "idShort": "MRobotReturnStackError",
            "category": "PARAMETER",
            "modelType": {
                "name": "Operation"
            }
        },
        {
            "refI4SubmodelElement": "urn:ngsi-v2:RAMI40:I4SubmodelElementOperation:OperationalCapability:MRobotExecuteTask:AASMRobotVI",
            "idShort": "MRobotExecuteTask",
            "category": "PARAMETER",
            "modelType": {
                "name": "Operation"
            }
        },
        {
            "refI4SubmodelElement": "urn:ngsi-v2:RAMI40:I4SubmodelElementOperation:OperationalCapability:MRobotStop:AASMRobotVI",
            "idShort": "MRobotStop",
            "category": "PARAMETER",
            "modelType": {
                "name": "Operation"
            }
        },
        {
            "refI4SubmodelElement": "urn:ngsi-v2:RAMI40:I4SubmodelElementOperation:OperationalCapability:MRobotEmergencyStop:AASMRobotVI",
            "idShort": "MRobotEmergencyStop",
            "category": "PARAMETER",
            "modelType": {
                "name": "Operation"
            }
        },
        {
            "refI4SubmodelElement": "urn:ngsi-v2:RAMI40:I4SubmodelElementOperation:OperationalCapability:MRobotResume:AASMRobotVI",
            "idShort": "MRobotResume",
            "category": "PARAMETER",
            "modelType": {
                "name": "Operation"
            }
        },
        {
            "refI4SubmodelElement": "urn:ngsi-v2:RAMI40:I4SubmodelElementOperation:OperationalCapability:VIStop:AASMRobotVI",
            "idShort": "VIStop",
            "category": "PARAMETER",
            "modelType": {
                "name": "Operation"
            }
        },
        {
            "refI4SubmodelElement": "urn:ngsi-v2:RAMI40:I4SubmodelElementOperation:OperationalCapability:VIStart:AASMRobotVI",
            "idShort": "VIStart",
            "category": "PARAMETER",
            "modelType": {
                "name": "Operation"
            }
        },
        {
            "refI4SubmodelElement": "urn:ngsi-v2:RAMI40:I4SubmodelElementOperation:OperationalCapability:VIReturnStackError:AASMRobotVI",
            "idShort": "VIReturnStackError",
            "category": "PARAMETER",
            "modelType": {
                "name": "Operation"
            }
        },
        {
            "refI4SubmodelElement": "urn:ngsi-v2:RAMI40:I4SubmodelElementOperation:OperationalCapability:VIHistData:AASMRobotVI",
            "idShort": "VIHistData",
            "category": "PARAMETER",
            "modelType": {
                "name": "Operation"
            }
        }
    ]
}